{
  "$schema": "./schema.json",
  "name": {
    "en": "100 - Burger buns",
    "fr": "100 - Pains burger"
  },
  "ingredients": [
    {
      "name": "allPurposeFlour",
      "bakerPercentage": 100
    },
    {
      "name": "activeDryYeast",
      "bakerPercentage": 1.6
    },
    {
      "name": "salt",
      "bakerPercentage": 1.8
    },
    {
      "name": "brownSugar",
      "bakerPercentage": 3
    },
    {
      "name": "egg",
      "bakerPercentage": 10
    },
    {
      "name": "oatMilk",
      "bakerPercentage": 6
    },
    {
      "name": "water",
      "bakerPercentage": 40
    },
    {
      "name": "butter",
      "bakerPercentage": 10
    }
  ],
  "presetTotalIngredient": 862,
  "notes": {
    "fr": ["1 pain ~= 110g"]
  }
}
