{
  "$schema": "./schema.json",
  "name": {
    "en": "200 - Brioche",
    "fr": "200 - Brioche"
  },
  "ingredients": [
    {
      "name": "allPurposeFlour",
      "bakerPercentage": 100
    },
    {
      "name": "salt",
      "bakerPercentage": 1.8
    },
    {
      "name": "activeDryYeast",
      "bakerPercentage": 1.8
    },
    {
      "name": "brownSugar",
      "bakerPercentage": 12
    },
    {
      "name": "oatMilk",
      "bakerPercentage": 50
    },
    {
      "name": "egg",
      "bakerPercentage": 10
    },
    {
      "name": "butter",
      "bakerPercentage": 30
    }
  ],
  "presetTotalIngredient": 1028,
  "notes": {
    "fr": [
      "Nanterre : 400g (8*50)",
      "Courrone : 400g",
      "Tresse 3 brins : 450g (3*150)",
      "Tresse 1 brin : 70g"
    ]
  }
}
