{
  "$schema": "./schema.json",
  "name": {
    "en": "100 - Financier",
    "fr": "100 - Financier"
  },
  "ingredients": [
    {
      "name": "eggWhite",
      "bakerPercentage": 100
    },
    {
      "name": "butter",
      "bakerPercentage": 83.3
    },
    {
      "name": "allPurposeFlour",
      "bakerPercentage": 50
    },
    {
      "name": "almondFlour",
      "bakerPercentage": 66.6
    },
    {
      "name": "whiteSugar",
      "bakerPercentage": 111
    }
  ],
  "presetTotalIngredient": 740,
  "notes": {
    "fr": [
      "1 blanc oeuf ~= 30g",
      "Moule rond 60g",
      "Moule rectangle 100g",
      "Cuisson 25-30mins 200C conventionnel"
    ]
  }
}
