{
  "$schema": "./schema.json",
  "name": {
    "en": "200 - Challah",
    "fr": "200 - Challah"
  },
  "ingredients": [
    {
      "name": "allPurposeFlour",
      "bakerPercentage": 100
    },
    {
      "name": "activeDryYeast",
      "bakerPercentage": 0.6
    },
    {
      "name": "honey",
      "bakerPercentage": 18.8
    },
    {
      "name": "salt",
      "bakerPercentage": 1.8
    },
    {
      "name": "egg",
      "bakerPercentage": 16.6
    },
    {
      "name": "water",
      "bakerPercentage": 28.3
    },
    {
      "name": "oliveOil",
      "bakerPercentage": 12.5
    }
  ],
  "presetTotalIngredient": 1073,
  "notes": {
    "fr": ["Sponge : 100% levure, 100% eau + Ã©quivalent farine"]
  }
}
