{
  "$schema": "./schema.json",
  "name": {
    "en": "100 - Pate brisee",
    "fr": "100 - Pate brisee"
  },
  "ingredients": [
    {
      "name": "allPurposeFlour",
      "bakerPercentage": 100
    },
    {
      "name": "eggYolk",
      "bakerPercentage": 9
    },
    {
      "name": "water",
      "bakerPercentage": 18
    },
    {
      "name": "salt",
      "bakerPercentage": 3.65
    },
    {
      "name": "butter",
      "bakerPercentage": 45.5
    }
  ],
  "presetTotalIngredient": 388,
  "notes": {
    "fr": [
      "~1 cercle 24cm 4mm Ã©paisseur"
    ]
  }
}
