{
  "$schema": "./schema.json",
  "name": {
    "en": "100 - Bao Dough",
    "fr": "100 - Pate Ã  bao"
  },
  "ingredients": [
    {
      "name": "allPurposeFlour",
      "bakerPercentage": 100
    },
    {
      "name": "water",
      "bakerPercentage": 50
    },
    {
      "name": "activeDryYeast",
      "bakerPercentage": 1
    },
    {
      "name": "bakingPowder",
      "bakerPercentage": 1
    },
    {
      "name": "whiteSugar",
      "bakerPercentage": 6
    }
  ],
  "presetTotalIngredient": 790,
  "notes": {
    "fr": ["1 bao ~= 66g"]
  }
}
